{
  "protocol_version": 1,
  "candidate_id": "learning-funnel-001",
  "learning_type": "correction-candidate",
  "system_ref": "analisar-funil",
  "routine_id": "funil-diario-cerebro",
  "source_correction_ref": "correction-run:correction-funnel-001",
  "evidence_run_ref": "routine-receipt:routine-receipt-funnel-002",
  "approval_judgment_ref": "judgment-receipt:judgment-funnel-approval-002",
  "status": "candidate",
  "occurrences": 1,
  "promotion_threshold": 3,
  "replay_status": "not-eligible",
  "created_by": "role-marketing-owner",
  "created_at": "2026-08-24T11:40:00.000Z",
  "privacy": {
    "content_shared_with_inevita": false,
    "correction_recorded": false,
    "output_recorded": false,
    "motor_changed": false,
    "external_action_executed": false
  }
}
